{
    "original": "EKE\n\nVarunamn: Ekmärket\nVeikst din Ake Nilsson\nEtableringsår: 1922.\n\nABC ÖVERSÄTTNINGAR\n\nPnr 127 32\n\nSkärholmen, Algrytev 117. Tel\n08-46 90 32, 64 88 73\n\nVerksamhet: Översättning o\nkorrekturläsning\n\nVerkst dir: Robert Roady\nEtableringsår: 1970.\n\nABC-FABRIKERNA, AB\nB RUDE RNA CLAESSON\n\nPnr 442 00\n\nKungälv. Tel 0303-10900.\nBankgiro 54-7112. Postgiro 7557. Tga\nABC-Pabrikerna\nVerksamhet: Tillverkar o säljer\nreseffekter samt sport- o\ncampingartiklar\n\nStockholmsnederlaget: Stockholm\nO. Styrmansg 14. Tel 08-63 07 55\nAntal anställda: 700\nÅrsomsättning: 30 000 000\nAktiekapital: 350 000\nEtableringsår: 1909.\n\nVEGAKONSULT, AB\n\nPnr 104 32\n\nStockholm 19, Tuleg 13. Fack.\nTel 08-23 65 40. Postgiro 507324\nVerksamhet: Konsulterande företag\nAntal anställda: 40\nÅrsomsättning: 2 000 000\nAktiekapital: 5 000\nVerkst dir: Jan-Erik Ryman\nEtableringsår: 1954.\n\nINNOVIA AB\n\nPnr 412 55\n\nGöteborg, Johannebergsg 26. Tel\n031-201153\n\nVerksamhet: Transportsystem,\nförpacknings- o pallastningsmaskiner\nAktiekapital: 50 000\nVerkst dir: Civiling Ragnar\nHalle-nius\n\nEtableringsår: 1970.\n\nRÅDA-SAND, AB\n\nPnr 531 00\n\nLidköping. Tel 0510-140 03,140 34.\nBankgiro 21-2006. Postgiro 90099\nVerksamhet: Tillverkar\nfabriks-blandad betong\nAntal anställda: 46\nÅrsomsättning: 4 000 000\n\nAktiekapital: 100 000\nVerkst dir Fabr Einar Jansson\nEtableringsår: 1965.\n\nARN\n\nAHRNBERG&amp; CO, S\n\nPnr 400 72\n\nGöteborg 22, Box 22097. V\nStilles-tcrpsg 19. Tel 031-515159,\n51 51 60. Bankgiro 50-0651. Tga\nSaco\n\nVerksamhet: Säljer järnvaror\nÄgare o chef: Dir S Ahrnberg\nEtableringsår: 1931.\n\nSKINNSPEDITION AB\n\nPnr 112 47\n\nStockholm, Alströmerg 33. Tel\n08-5213 03, 5213 04. Bankgiro\n567-0666. Postgiro 192858-9. Tga\nSkinnsped. Telex 10727\nVerksamhet: Specialitet: skinn- o\npälsvaror\nAntal anställda: 8\nÅrsomsättning: 7 500 000\nAktiekapital: 20 000\nVerkst dir: Ewert Sandberg\nEtableringsår. 1942.\n\nMIS\n\nVarunamn: Minwool\nAntal anställda: 61\nÅrsomsättning: 13 900 000\nAktiekapital: 1400 000\nStyrelse: Dir Bertil Carlén (ordf),\ndir Göran Carlén, dir Ch Friman,\ndir Bo Rydin, dir Karlerik Savén\nVeikst dir: Ch Friman\nPlatschef: Disp Egon Jansson\nEtableringsår: 1961.\n\nKANOR-PLAST AB\n\nPnr 235 00\n\nVellinge, Hököpinge 55. Tel\n040-46 65 22. Bankgiro 293-9148.\nPostgiro 530448-0\n\nVerksamhet: Formsprutning av\nplast: sportfiskeartiklar,\nindustriartiklar, förpackningsartiklar,\ngardin- o persienndetaljer\nAntal anställda: 6\nÅrsomsättning: 1000 000\nAktiekapital: 40 000\nVerkst dir: Kaj Nordström\nEtableringsår: 1957.\n\nKANOT-GEDDA\nPALL OCH RAM\n\nPnr 441 02\n\nAlingsås 2, Fack. V Bodarne. Tel\n0322-510 74, 514 74. Bankgiro\n436-7348. Postgiro 202768-8\nVerksamhet: Lastpallar, pallramar\no specialpallar\nÄgare o chef: Mårten Gedda\nEtableringsår: 1933.\n\nFAC\n\n73101 Köping 1, O Lång g 9-11. Tel\n0221-11045, 12545, 10140\n26122 Landskrona, Stora Norreg 17.\nTel 0418-137 72\n\n18142 Lidingö, Vasav 9. Tel\n08-765 99 65\n\n53100 Lidköping, Järnvägsg 6. Tel\n0510-204 35, 250 45\n216 15 Limhamn, Linnég 72. Tel\n040-15 99 89\n\n71100 Lindesberg, Kungsg 40. Tel\n\n0581-11244, 12164\n\n58102 Linköping 1. Sankt Larsg 15.\n\nTel 013-10 22 60\n\n34100 Ljungby, Kungsg 1. Tel\n\n0372-106 40, 142 70\n\n82700 Ljusdal. S Järnvägsg 9. Tel\n\n0651-100 33\n\n771 01 Ludvika 1. Köpmang 7. Tel\n0240-122 55. 11919\n95100 Luleå, Storg 13. Tel\n0920-205 80\n\n222 22 Lund, LUla Piskareg 5. Tel\n046-1246 60. 1246 63\n92100 Lycksele, Borgarg 14. Tel\n0950-109 49\n\n20110 Malmö, Citadellsv 9. Tel\n040-709 80\n\n782 00 Malung, Brog 6. Tel\n0280-11349\n\n54200 Mariestad, österlångg 16.\nTel 0501-11139. 11159\n595 00 Mjölby. Kungsv 54. Tel\n0142-122 65\n\n792 00 Mora. Kyrkog 10. Tel\n0250-100 47, 129 96\n\n59100 Motala, Kungsg 9. Tel\n0141-11927. 11988\n\n195 00 Märsta, Centrum. Tel\n0760-128 01, 14511\n\n43122 Mölndal, Knarrhögsg 10. Tel\n\n031-27 84 60, 27 30 92\n\n13100 Nacka. Sickla Strand 41. Tel\n\n08-716 75 00. 716 77 01\n\n600 02 Norrköping 2, Drottningg 53.\n\nTel 011-13 95 70\n\n76100 Norrtälje. Stockholmsv 21.\n\nTel 0176-123 03, 12405\n\n382 00 Nybro. Storg 30. Tel 0481-\n\n11120\n\n61101 Nyköping 1, O Kyrkog 17.\nTel 0155-113 00, 188 10, 195 20\n149 00 Nynäshamn, Centralg 75.\nTel 0752-123 28\n\n571 00 Nässjö, Brog 3. Tel\n0380-140 00, 107 14\n\n57200 Oskarshamn, Köpmang 22.\nTel 0491-108 43, 152 00\n613 00 Oxelösund, Nytorgsg 7-9.\nTel 0155-316 00\n\n94 1 00 Piteå, Storg 70. Tel\n0911-123 30, 123 33\n\n37200 Ronneby, Peder Holmsg 18.\nTel 0457-108 75\n\n733 00 Sala, Norrbyg 19. Tel\n0224-109 60\n\n81106 Sandviken, Högbov 2. Tel\n026-25 45 71\n\n272 00 Simrishamn, Järnvägsg 13.\nTel 0414-110 30\n\n93101 Skellefteå 1, S Järnvägsg 47.\nTel 0910-362 00\n\n54100 Skövde, Hertig Johans Gata\n10. Tel 0500-175 70, 113 78\n881 01 Sollefteå 1, Storg 79 B. Tel\n0620-109 06\n\n17104 Solna 4, Centralv 23. Tel\n08-83 0210\n\n444 00 Stenungsund, Hantverkarg 14.\nTel 0303-713 57, 803 76\n10380 Stockholm 7,\nKungsträd-gårdsg 20. Tel 08-23 7580\n152 00 Strängnäs. Storg 14. Tel\n0152-125 00, 124 00\n\n172 22 Sundbyberg l.Fredsg 17.\nTel 08-29 02 40\n\n851 03 Sundsvall, Landsvägsallén\n4. Tel 060-1555 45, 15 77 30\n\n661\t00 Säffle, V Storg 18. Tel\n0533-11257\n\n826 00 Söderhamn, Oxtorget 1. Tel\n0270-114 71\n\n151 22 Södertälje 1, Sankt\nRagn-hildsg 24-26. Tel 0755-32705\n543 00 Tibro, Mariestadsv 13. Tel\n0504-124 85\n\n573\t00 Tranås, Storg 15. Tel\n0140-14716\n\n23101 Trelleborg 1, Osterg 10. Tel\n0410-124 95\n\n46101 Trollhättan 1, Föreningsg 9.\nTel 0520-119 95, 174 85\n451 01 Uddevalla 1. Kilbäcksg 29.\nTel 0522-141 50\n\n523 00 Ulricehamn, Lilla Torget 2.\nTel 0321-131 19, 136 35\n90102 Umeå 1, Kungsg 51. Tel\n090-13 47 30\n\n75105 Uppsala, Sankt Olofsg 46.\nTel 918-12 00 60\n\nTel 018-12 00 60, 12 00 62, 12 00 63\n432 00 Varberg, Drottningg 25. Tel\n0340-11127, 142 30\n\n574\t00 Vetlanda, Storg 39. Tel\n0383-113 34\n\n91200 Vilhelmina, Skolg 3. Tel\n0940-100 80\n\n598 00 Vimmerby, Storg 62. Tel\n\n0492-109 50, 109 54\n\n62101 Visby 1. Adelsg 26. Tel\n\n0498-108 44, 148 42\n\n16212 Vällingby 1. Multråg 142.\n\nTel 08-37 26 70\n\n462 01 Vänersborg 1, Edsg 1 A.\n\nTel 051-122 24, 10274\n\n33101 Värnamo 1, Växjöv 7 B. Tel\n\n0370-108 80, 148 80\n\n593 00 Västervik, Allén 4. Tel\n\n0490-106 30, 116 30\n\n721 08 Västerås 1, Ostermalmsg\n\n15 B. Tel 021-1100 90\n\n351 03 Växiö. Sandgärdsg 9. Tel\n\n0470-23175\n\n27100 Ystad, Hamng 10. Tel\n0411-119 60\n\n662\t00 Amål, Lunneg 11. Tel\n0532-11120. 136 20, 115 50\n\n262 01 Ängelholm 1, Skolg 5. Tel\n0431-118 99\n\n70103 OTebro 1, Drottningg 22. Tel\n019-1247 95, 1899 07\n89100 Örnsköldsvik, Storg 4. Tel\n0660-10140, 113 44\n83101 Östersund 1, Färjemansg\n15 A. Tel 063-24685\nAktiekapital: 80 000 000\nVerkst dir: Lennart von Kantzow\nEtableringsår: 1922\nModerbolag för: Facit-Halda AB,\nSvängsta, AB Original-Odhner,\nGöteborg, AB Overums Bruk, Overum,\nAB Addo, Malmö.\n\nFACIT.HALDA AB\n\nPnr 290 70\n\nSvängsta. Tel 0454-225 00.\nBankgiro 656-5220. Postgiro 22475-8.\nTga Facit, Karlshamn.\nTelex 4568 FACITKH S\nVerksamhet: Tillverkar manuella\no elektriska kontorsskrivmaskiner\no hemskrivmaskiner samt\npressgjutgods av aluminium\nVarunamn: Facit\nAntal anställda: 1 600\nAktiekapital: 6 000 000\nStyrelse: Dir Gunnar Ericsson (ordf),\ndir Bertil Axler.dir Ellard Berntorp,\n\ndir Lennart von Kantzow, jur dr\n\nCarl Martin Roos\n\nVerkst dir: Ellard Berntorp\n\nEtableringsår: 1887\n\nDotterbolag till Facit AB, Atvida-\n\nberg.\n\nFACKMAN FOTO AB\n\nPnr 162 26\n\nVällingby, Silversmedsplan 24-26.\nTel 08-37 9661, 37 9662. Bankgiro\n745-7617. Postgiro 259545-2. Tga\nFackmanco\n\nVerksamhet: Utför foto- o\nljus-kopieringsarbeten. Säljer foto- o\nljuskopieringsmaskiner o -material,\nstålskåp o stålmöbler\nAntal anställda: 7\nÅrsomsättning: 500 000\nAktiekapital: 18 000\nVerkst dir: Major Nils Edéus\nEtableringsår: 1947.",
    "structured": {
        "1": {
            "company_name": "Ekmärket",
            "establishment_year": 1922,
            "activity": "Översättning och korrekturläsning"
        },
        "2": {
            "company_name": "ABC ÖVERSÄTTNINGAR",
            "pnr": "127 32",
            "address": "Skärholmen, Algrytev 117",
            "phone_number": "08-46 90 32, 64 88 73",
            "activity": "Tillverkar och säljer reseffekter samt sport- och campingartiklar",
            "employees": 700,
            "annual_turnover": 30000000,
            "capital": 350000,
            "establishment_year": 1909
        },
        "3": {
            "company_name": "VEGAKONSULT AB",
            "pnr": "104 32",
            "address": "Stockholm 19, Tuleg 13",
            "phone_number": "08-23 65 40",
            "activity": "Konsulterande företag",
            "employees": 40,
            "annual_turnover": 2000000,
            "capital": 5000,
            "establishment_year": 1954
        },
        "4": {
            "company_name": "INNOVIA AB",
            "pnr": "412 55",
            "address": "Göteborg, Johannebergsg 26",
            "phone_number": "031-201153",
            "activity": "Transportsystem, förpacknings- och pallastningsmaskiner",
            "capital": 50000,
            "establishment_year": 1970
        },
        "5": {
            "company_name": "RÅDA-SAND AB",
            "pnr": "531 00",
            "address": "Lidköping",
            "phone_number": "0510-140 03, 140 34",
            "activity": "Tillverkar fabriksblandad betong",
            "employees": 46,
            "annual_turnover": 4000000,
            "capital": 100000,
            "establishment_year": 1965
        },
        "6": {
            "company_name": "AHRNBERG & CO, S",
            "pnr": "400 72",
            "address": "Göteborg 22, Box 22097, Stilles-tcrpsg 19",
            "phone_number": "031-515159, 51 51 60",
            "activity": "Säljer järnvaror",
            "establishment_year": 1931
        },
        "7": {
            "company_name": "SKINNSPEDITION AB",
            "pnr": "112 47",
            "address": "Stockholm, Alströmerg 33",
            "phone_number": "08-5213 03, 5213 04",
            "activity": "Specialitet: skinn- och pälsvaror",
            "employees": 8,
            "annual_turnover": 7500000,
            "capital": 20000,
            "establishment_year": 1942
        },
        "8": {
            "company_name": "MINWOOL",
            "employees": 61,
            "annual_turnover": 13900000,
            "capital": 1400000,
            "key_personnel": [
                {
                    "name": "Bertil Carlén",
                    "position": "ordförande"
                },
                {
                    "name": "Göran Carlén",
                    "position": "direktör"
                },
                {
                    "name": "Ch Friman",
                    "position": "direktör"
                },
                {
                    "name": "Bo Rydin",
                    "position": "direktör"
                },
                {
                    "name": "Karlerik Savén",
                    "position": "direktör"
                }
            ],
            "establishment_year": 1961
        },
        "9": {
            "company_name": "KANOR-PLAST AB",
            "pnr": "235 00",
            "address": "Vellinge, Hököpinge 55",
            "phone_number": "040-46 65 22",
            "activity": "Formsprutning av plast: sportfiskeartiklar, industriartiklar, förpackningsartiklar, gardin- och persienndetaljer",
            "employees": 6,
            "annual_turnover": 1000000,
            "capital": 40000,
            "establishment_year": 1957
        },
        "10": {
            "company_name": "KANOT-GEDDA PALL OCH RAM",
            "pnr": "441 02",
            "address": "Alingsås 2, Fack. V Bodarne",
            "phone_number": "0322-510 74, 514 74",
            "activity": "Lastpallar, pallramar, och specialpallar",
            "establishment_year": 1933
        },
        "11": {
            "company_name": "FACIT.HALDA AB",
            "pnr": "290 70",
            "address": "Svängsta",
            "phone_number": "0454-225 00",
            "activity": "Tillverkar manuella och elektriska kontorsskrivmaskiner och hemskrivmaskiner samt pressgjutgods av aluminium",
            "employees": 1600,
            "annual_turnover": null,
            "capital": 6000000,
            "establishment_year": 1887
        },
        "12": {
            "company_name": "FACKMAN FOTO AB",
            "pnr": "162 26",
            "address": "Vällingby, Silversmedsplan 24-26",
            "phone_number": "08-37 9661, 37 9662",
            "activity": "Utför foto- och ljuskopieringsarbeten. Säljer foto- och ljuskopieringsmaskiner och -material, stålskåp och stålmöbler",
            "employees": 7,
            "annual_turnover": 500000,
            "capital": 18000,
            "establishment_year": 1947
        }
    }
}